{
    "$schema": "../chain.schema.json",
    "chain_name": "fetchhub",
    "status": "live",
    "network_type": "mainnet",
    "pretty_name": "Fetch Hub",
    "chain_id": "fetchhub-2",
    "bech32_prefix": "fetch",
    "daemon_name": "fetchd",
    "node_home": "$HOME/.fetchd",
    "genesis": {
        "genesis_url": "https://raw.githubusercontent.com/fetchai/genesis-fetchhub/14c62009a35486b233fcb3de48f3dcd006dab240/data/genesis.json"
    },
    "slip44": 118,
    "codebase": {
        "git_repo": "https://github.com/fetchai/fetchd",
        "recommended_version": "v0.8.7",
        "compatible_versions": [
            "v0.8.7"
        ]
    },
    "peers": {
        "seeds": [
            {
                "id": "c240ca38b990a7d3f25621eb848d0222d5b50278",
                "address": "connect-fetchhub.fetch.ai:36656",
                "provider": "fetch.ai"
            },
            {
                "id": "3e19e092c5ddd19a6aa8ba87fa8a37566d4f7f38",
                "address": "connect-fetchhub.fetch.ai:36657",
                "provider": "fetch.ai"
            },
            {
                "id": "b75b1ed0a1257e99d41b48d0704a605854d80514",
                "address": "connect-fetchhub.fetch.ai:36658",
                "provider": "fetch.ai"
            }
        ],
        "persistent_peers": [
            {
                "id": "d70030b25de2317e7d6bad482d4cb186c72a5e39",
                "address": "sentries-fetchhub.fetch.ai:36600",
                "provider": "fetch.ai"
            },
            {
                "id": "42f2879b8feec50937234a20a54a87d5c350d680",
                "address": "sentries-fetchhub.fetch.ai:36601",
                "provider": "fetch.ai"
            },
            {
                "id": "56f1049931e9ce9777180460fed912b708205ed5",
                "address": "sentries-fetchhub.fetch.ai:36602",
                "provider": "fetch.ai"
            }
        ]
    },
    "apis": {
        "rpc": [
            {
                "address": "https://rpc-fetchhub.fetch.ai:443",
                "provider": "fetch.ai"
            }
        ],
        "rest": [
            {
                "address": "https://rest-fetchhub.fetch.ai",
                "provider": "fetch.ai"
            }
        ],
        "grpc": [
            {
                "address": "https://grpc-fetchhub.fetch.ai:443",
                "provider": "fetch.ai"
            }
        ]
    },
    "explorers": [
        {
            "kind": "mintscan",
            "url": "https://www.mintscan.io/fetchai",
            "tx_page": "https://www.mintscan.io/fetchai/txs/${txHash}"
        },
        {
            "kind": "bigdipper",
            "url": "https://explore-fetchhub.fetch.ai",
            "tx_page": "https://explore-fetchhub.fetch.ai/transactions/${txHash}"
        }
    ]
}
