{
  "$schema": "../chain.schema.json",
  "chain_name": "agoric",
  "status": "live",
  "network_type": "mainnet",
  "pretty_name": "Agoric",
  "chain_id": "agoric-3",
  "bech32_prefix": "agoric",
  "daemon_name": "ag0",
  "node_home": "$HOME/.agoric",
  "genesis": {
    "genesis_url": "https://main.agoric.net/genesis.json"
  },
  "slip44": 564,
  "explorers": [
    {
      "name": "agoric-big-dipper",
      "url": "https://main.explorer.agoric.net/"
    }
  ],
  "codebase": {
    "git_repo": "https://github.com/Agoric/ag0/",
    "recommended_version": "agoric-3.1",
    "compatible_versions": [
      "agoric-3.1"
    ]
  },
  "peers": {
    "seeds": [],
    "persistent_peers": [
      {
        "id": "a26158a5cbb1df581dd6843ac427191af76d6d5d",
        "address": "104.154.240.50:26656"
      },
      {
        "id": "6e26a1b4afa6889f841d7957e8c2b5d50d32d485",
        "address": "95.216.53.26:26656"
      }
    ]
  },
  "apis": {
    "rpc": [
      {
        "address": "https://main.rpc.agoric.net:443"
      }
    ],
    "rest": [
      {
        "address": "https://main.api.agoric.net:443"
      }
    ],
    "grpc": [
      {
        "address": "https://main.grpc.agoric.net:443"
      }
    ]
  }
}