{
    "$schema": "../chain.schema.json",
    "chain_name": "irisnet",
    "status": "live",
    "network_type": "mainnet",
    "pretty_name": "Irisnet",
    "chain_id": "irishub-1",
    "bech32_prefix": "iris",
    "daemon_name": "irisd",
    "node_home": "$HOME/.irisd",
    "key_algos": [
        "secp256k1"
      ],
    "slip44": 118,
    "genesis": {
        "genesis_url": "https://raw.githubusercontent.com/irisnet/mainnet/master/config/genesis.json"
    },
    "codebase": {
        "git_repo": "https://github.com/irisnet/irishub",
        "recommended_version": "v1.2.1",
        "compatible_versions": ["v1.2.1"]
    },
    "peers": {
        "seeds": [
            {
              "id": "6a6de770deaa4b8c061dffd82e9c7f4d40c2165d",
              "address": "seed-1.mainnet.irisnet.org:26656"
            },
            {
              "id": "a17d7923293203c64ba75723db4d5f28e642f469",
              "address": "seed-2.mainnet.irisnet.org:26656"
            }
        ],
        "persistent_peers": [
            {
                "id": "fdc0406afdd3acc63f74f5439e09104f663a7c1f",
                "address": "44.241.177.178:26656",
                "provider": "cosmostation"
            },
            {
                "id": "090bcbe5302e6104821a96c4899912870db04cb9",
                "address": "52.11.128.123:26656",
                "provider": "cosmostation"
            },
            {
                "id": "83b3f989f3ce089afdf733f8aa06e792d7e00c08",
                "address": "3.34.6.30:26656",
                "provider": "cosmostation"
            },
            {
                "id": "87f18756b93d835c59fe5ce2a8da51858837eb5b",
                "address": "54.180.15.28:26656",
                "provider": "Node-A-Team"
            },
            {
                "id": "90e48220190b16cad95145b6213d512d703e5617",
                "address": "138.197.158.189:26656",
                "provider": "Figment"
            },
            {
                "id": "ebfb43ca1b592b5f8a1faf3e2aa1a34e8e1099cc",
                "address": "iris01.dokia.cloud:26656",
                "provider": "Dokia"
            },
            {
                "id": "92fadc989ed29aee0d46afce3226f8565d1f36cb",
                "address": "144.91.116.17:46656",
                "provider": "syncnode"
            },
            {
                "id": "4ac6200974d3fd80a8e49d145a2c254ed37a9b9a",
                "address": "159.69.106.156:26656",
                "provider": "P2P.ORG"
            },
            {
                "id": "4e02a4b4f4350ea2b770cd03dc41fedcadb13176",
                "address": "159.69.55.206:26656",
                "provider": "P2P.ORG"
            },
            {
                "id": "84cc32adca3986b35953886ad075431d318a98b5",
                "address": "52.214.130.28:46656",
                "provider": "stake.fish"
            }
        ]
    },
    "apis": {
        "rpc": [
            {
                "address": "https://rpc-iris.keplr.app",
                "provider": "chainapsis"
            }
        ],
        "rest": [
            {
                "address": "https://lcd-iris.keplr.app",
                "provider": "chainapsis"
            }
        ]
    },
    "explorers": [
        {
            "kind": "mintscan",
            "url": "https://www.mintscan.io/iris",
            "tx_page": "https://www.mintscan.io/iris/txs/${txHash}"
        }
    ]
}
