{
    "$schema": "../chain.schema.json",
    "chain_name": "panacea",
    "status": "live",
    "network_type": "mainnet",
    "pretty_name": "Panacea",
    "chain_id": "panacea-3",
    "bech32_prefix": "panacea",
    "daemon_name": "panacead",
    "node_home": "$HOME/.panacead",
    "genesis": {
        "genesis_url": "https://github.com/medibloc/panacea-mainnet/raw/master/panacea-3/genesis.json"
    },
    "key_algos": [
        "secp256k1"
    ],
    "slip44": 371,
    "fees": {
        "fee_tokens": [
            {
                "denom": "umed",
                "fixed_min_gas_price": 5
            }
        ]
    },
    "codebase": {
        "git_repo": "https://github.com/medibloc/panacea-core",
        "recommended_version": "v2.0.2",
        "compatible_versions": [
            "v2.0.2"
        ],
        "binaries": {}
    },
    "peers": {
        "persistent_peers": [
            {
                "id": "e93f5df69cc1b9bda230b3efcf162d4672293ded",
                "address": "3.35.82.40:26656",
                "provider": "medibloc"
            },
            {
                "id": "0e0db1c7ab1e37c76f2ceced0bb72e1c60ef17a6",
                "address": "13.124.96.254:26656",
                "provider": "medibloc"
            },
            {
                "id": "a83232db3a40e486b54b1463a43431e8490b808b",
                "address": "52.79.108.35:26656",
                "provider": "medibloc"
            }
        ]
    },
    "apis": {
        "rpc": [
            {
                "address": "https://rpc.gopanacea.org",
                "provider": "medibloc"
            }
        ],
        "rest": [
            {
                "address": "https://api.gopanacea.org",
                "provider": "medibloc"
            }
        ]
    },
    "explorers": [
        {
            "kind": "mintscan",
            "url": "https://www.mintscan.io/medibloc",
            "tx_page": "https://www.mintscan.io/medibloc/txs/${txHash}"
        },
        {
            "kind": "bigdipper",
            "url": "https://explorer.gopanacea.org",
            "tx_page": "https://explorer.gopanacea.org/transactions/${txHash}"
        }
    ]
}
