{
    "$schema": "../chain.schema.json",
    "chain_name": "carbon",
    "status": "live",
    "network_type": "mainnet",
    "pretty_name": "Carbon",
    "chain_id": "carbon-1",
    "bech32_prefix": "swth",
    "daemon_name": "carbond",
    "node_home": "$HOME/.carbond",
    "genesis": {
        "genesis_url": "https://github.com/Switcheo/carbon-bootstrap/raw/master/carbon-1/genesis.json"
    },
    "key_algos": [
        "secp256k1"
    ],
    "slip44": 118,
    "fees": {
        "fee_tokens": [
            {
                "denom": "swth",
                "fixed_min_gas_price": 0
            }
        ]
    },
    "codebase": {
        "git_repo": "https://github.com/Switcheo/carbon-bootstrap",
        "recommended_version": "v2.2.0",
        "compatible_versions": [],
        "binaries": {
            "linux/amd64": "https://github.com/Switcheo/carbon-bootstrap/releases/download/v2.2.0/carbond2.2.0-mainnet.linux-amd64.tar.gz",
            "linux/arm64": "https://github.com/Switcheo/carbon-bootstrap/releases/download/v2.2.0/carbond2.2.0-mainnet.linux-ard64.tar.gz"
        }
    },
    "peers": {
        "seeds": [
            {
                "id": "d93ed6a1f43dd0904dc5e2ab8680d4049b057b17",
                "address": "13.215.17.91:26656",
                "provider": "switcheo-labs"
            },
            {
                "id": "70581c625fc1933bc273ca7a8d5e9ded3d1bcc97",
                "address": "13.213.113.113:26656",
                "provider": "switcheo-labs"
            },
            {
                "id": "e3f02a9f3ca22724b3a67bba9183113645c9c7d9",
                "address": "54.179.11.177:26656",
                "provider": "switcheo-labs"
            }
        ],
        "persistent_peers": [
            {
                "id": "b638cc8fc5b3d7867281081efce15e5a989339ac",
                "address": "188.166.191.195:26656",
                "provider": "intsol"
            }
        ]
    },
    "apis": {
        "rpc": [
            {
                "address": "https://tm-api.carbon.network",
                "provider": "switcheo-labs"
            }
        ],
        "rest": [
            {
                "address": "https://api.carbon.network",
                "provider": "switcheo-labs"
            }
        ]
    },
    "explorers": [
        {
            "kind": "carbonscan",
            "url": "https://scan.carbon.network",
            "tx_page": "https://scan.carbon.network/transaction/${txHash}?net=main"
        }
    ]
}
