{
    "$schema": "../chain.schema.json",
    "chain_name": "thorchain",
    "status": "live",
    "network_type": "mainnet",
    "pretty_name": "THORChain",
    "chain_id": "thor-1",
    "bech32_prefix": "thor",
    "daemon_name": "thord",
    "node_home": "$HOME/.thornode",
    "slip44": 931,
    "genesis": {
        "genesis_url": "https://rpc.thorchain.info/genesis"
    },
    "codebase": {
        "git_repo": "https://gitlab.com/thorchain/thornode",
        "recommended_version": "chaosnet-multichain",
        "compatible_versions": [
            "chaosnet-multichain"
        ]
    },
    "peers": {
        "seeds": [
            {
                "id": "eef0b258a711fc2be06da8eb25a53ebd8e16da62",
                "address": "13.36.197.238:27146"
            },
            {
                "id": "02041c659d8588f225b3352df8636e05dcd239f7",
                "address": "18.169.114.61:27146"
            },
            {
                "id": "88783fa86645c41aaaf031f31df2ee1d74413880",
                "address": "18.202.205.93:27146"
            },
            {
                "id": "00783ce232787999a7b3ccdfdbd493f371203e60",
                "address": "51.136.76.139:27146"
            },
            {
                "id": "c3f3f920a7003585ea6489344b41dd248ffa1e8f",
                "address": "188.166.204.206:27146"
            },
            {
                "id": "46040fd7b9450772c43fa406ef821d5eb3f79114",
                "address": "134.209.136.64:27146"
            },
            {
                "id": "7581fbca995486787ac3619cddf4137e110aff11",
                "address": "143.198.247.31:27146"
            },
            {
                "id": "dcd52d42ee465dd23b5806b30eca8df8e9e76c5d",
                "address": "138.197.48.191:27146"
            },
            {
                "id": "3a520c0e7c2af48d33cfb425af9ea9caa5917b1e",
                "address": "18.214.28.114:27146"
            },
            {
                "id": "48b675fbb3bf968ebee7e366d72bb5580aa8162e",
                "address": "139.59.217.54:27146"
            },
            {
                "id": "f1513684dd9d574715304bf3dd3b53fbcce65909",
                "address": "34.145.173.217:27146"
            },
            {
                "id": "2dde4b30bf913c9b9adecb6b835b2654b50c5698",
                "address": "3.124.212.184:27146"
            },
            {
                "id": "97ab3ae9df723ef763d90128663e7de0f0568dbe",
                "address": "54.217.4.198:27146"
            },
            {
                "id": "7c3b0a1fd70c5c0154e40f6e1276f8dd171117e5",
                "address": "136.244.65.26:27146"
            },
            {
                "id": "79b84e53bd5e4c1a3ef309346136cc7528ba0bdf",
                "address": "64.225.81.243:27146"
            },
            {
                "id": "d8628418e84acf19a330dddbed3173cfb4a020a9",
                "address": "138.197.48.59:27146"
            },
            {
                "id": "7c884bbc48abbadbb0fb85bfaa1dff9e94eac401",
                "address": "143.244.211.46:27146"
            },
            {
                "id": "8757a66381b4182f74809461fd8a3fcaf203a820",
                "address": "34.212.187.195:27146"
            },
            {
                "id": "6a35ed1a50ee76f72d1cd5c688f2e5f7fbc5da25",
                "address": "52.228.231.228:27146"
            },
            {
                "id": "5842bbfc26cf87c2ae3db418a835511ef2a39277",
                "address": "3.96.249.116:27146"
            },
            {
                "id": "83d3c662b1287bc9292d75b4909cff63b119cc78",
                "address": "18.206.141.33:27146"
            },
            {
                "id": "14d576eb4a1a5a2e319511abd5ce2c6e20f51c31",
                "address": "13.36.138.187:27146"
            },
            {
                "id": "107d49ada5acf1dbfcc27b3f5f387d035421ccca",
                "address": "52.214.221.72:27146"
            },
            {
                "id": "ca15ae8f0e17112b63786482cca300ff473f41fd",
                "address": "3.140.128.35:27146"
            },
            {
                "id": "5e89caf0ca79e0fb3371d5892efd96d66042d0d6",
                "address": "157.90.34.75:27146"
            },
            {
                "id": "1c88aa9509832a592453bd7d30736db055a279d1",
                "address": "34.83.232.180:27146"
            },
            {
                "id": "de7c36a34d8e9a48106488de1bac21b172c2dd49",
                "address": "157.245.16.34:27146"
            },
            {
                "id": "3de5f5bff746dc9349b044d83ccb906924b8cf03",
                "address": "188.166.138.88:27146"
            },
            {
                "id": "3ede6d36ede3b7e1dec522c827ab6db94bfae749",
                "address": "34.145.160.5:27146"
            },
            {
                "id": "58a28719fdd46ea629859d85a1d5bc6a6363c185",
                "address": "159.65.212.234:27146"
            },
            {
                "id": "70dd6252ff95d8af7f3f488fdb98dde5d467213b",
                "address": "18.117.49.201:27146"
            },
            {
                "id": "6c7d780bb7384142f6943543ed4c3ba537f4a411",
                "address": "138.197.59.244:27146"
            },
            {
                "id": "523a3df9384190d1b30ff55d1783b4baed32165c",
                "address": "18.208.113.188:27146"
            },
            {
                "id": "c64b58f2498a29330e4927ba90dd6fb2955a7a56",
                "address": "159.89.210.106:27146"
            },
            {
                "id": "e592368bf73a32dbcc28def417f2fdb151f26da6",
                "address": "3.139.117.117:27146"
            },
            {
                "id": "19ab508b32a6518a450058c2c7a99b7a5cc4299f",
                "address": "13.237.27.250:27146"
            },
            {
                "id": "4e41bd4f8d1ec95ff4a305f0739c82e818664c12",
                "address": "135.181.58.7:27146"
            },
            {
                "id": "2d25606076036716a31611185d39880fe8237e97",
                "address": "3.230.67.253:27146"
            },
            {
                "id": "5a6e66f9f6c84d55de8f1170086f28d69d242ad4",
                "address": "78.141.210.66:27146"
            },
            {
                "id": "f296c1e1b03ab875925208aabb5b9c5b1626427e",
                "address": "52.32.91.52:27146"
            }
        ]
    },
    "apis": {
        "rpc": [
            {
                "address": "https://rpc.thorchain.info",
                "provider": "thorchain"
            }
        ],
        "rest": [
            {
                "address": "https://thornode.thorchain.info",
                "provider": "thorchain"
            }
        ],
        "sidechains_rpc": [
            {
                "address": "https://btc.thorchain.info",
                "provider": "btc"
            },
            {
                "address": "https://bch.thorchain.info",
                "provider": "bch"
            },
            {
                "address": "https://ltc.thorchain.info",
                "provider": "ltc"
            },
            {
                "address": "https://bnb.thorchain.info",
                "provider": "bnb"
            },
            {
                "address": "https://eth.thorchain.info",
                "provider": "eth"
            }
        ]
    },
    "explorers": [
        {
            "kind": "THORChain explorer",
            "url": "https://thorchain.net",
            "tx_page": "https://thorchain.net/#/txs/${txHash}"
        },
        {
            "kind": "viewblock",
            "url": "https://viewblock.io/thorchain",
            "tx_page": "https://viewblock.io/thorchain/tx/${txHash}"
        }
    ]
}
